<?xml  version="1.0" encoding="UTF-8" ?>
<empresa xmlns:xsi="~/Documents/LMSG/GIT-LM/XML/Practica/Deberes 22-03-2022/Clase.xml" xsi:noNamespaceSchemaLocation="empr.xsd">


<empresa nombre="ECI">

    <datosEmpresa>
        <nombre>ECI</nombre>
        <nTrabajadores>8</nTrabajadores>
        <sector>
            <tecnologia/>
            <educacion/>
        </sector>
    </datosEmpresa>

    <departamentos>
        <departamento nombre="administracion" codigoDep="ADMIN">

            <jefe>
                <nombre>Ana</nombre>
                <apellidos>Peña</apellidos>
                <baja/>
                <salario>6000</salario>
                <usuario nUsuario="anapea" clave="46322jken2"></usuario>
            </jefe>
            
            <trabajador>
                <nombre>Jose</nombre>
                <apellidos>Lopez</apellidos>
                <salario>2000</salario>
            </trabajador>

            <trabajador>
                <nombre>Luis</nombre>
                <apellidos>Nuñez</apellidos>
                <salario>1800</salario>
            </trabajador>

            <trabajador>
                <nombre>Martín</nombre>
                <apellidos>Martín</apellidos>
                <baja/>
                <salario>1800</salario>
            </trabajador>

        </departamento>

        <departamento nombre="informatica" codigoDep="INFOR">
        
            <jefe>
                <nombre>Lucas</nombre>
                <apellidos>Sorda</apellidos>
                <salario>6500</salario>
                <usuario nUsuario="lucsor" clave="84iejd98d3"></usuario>
            </jefe>
            
            <trabajador>
                <nombre>Helena</nombre>
                <apellidos>Hernandez</apellidos>
                <salario>4500</salario>
            </trabajador>

        </departamento>
    </departamentos>

</empresa>